{
  "@context": "https://linked.art/ns/v1/linked-art.json",
  "id": "https://linked.art/example/object/45",
  "type": "HumanMadeObject",
  "_label": "Example 16x20 Painting",
  "classified_as": [
    {
      "id": "http://vocab.getty.edu/aat/300033618",
      "type": "Type",
      "_label": "Painting",
      "classified_as": [
        {
          "id": "http://vocab.getty.edu/aat/300435443",
          "type": "Type",
          "_label": "Type of Work"
        }
      ]
    },
    {
      "id": "http://vocab.getty.edu/aat/300133025",
      "type": "Type",
      "_label": "Artwork"
    }
  ],
  "dimension": [
    {
      "type": "Dimension",
      "classified_as": [
        {
          "id": "http://vocab.getty.edu/aat/300055647",
          "type": "Type",
          "_label": "Width"
        }
      ],
      "value": 16,
      "unit": {
        "id": "http://vocab.getty.edu/aat/300379100",
        "type": "MeasurementUnit",
        "_label": "inches"
      },
      "identified_by": [
        {
          "type": "Name",
          "classified_as": [
            {
              "id": "http://vocab.getty.edu/aat/300404669",
              "type": "Type",
              "_label": "Display Title"
            }
          ],
          "content": "16 inches wide"
        }
      ]
    },
    {
      "type": "Dimension",
      "classified_as": [
        {
          "id": "http://vocab.getty.edu/aat/300055644",
          "type": "Type",
          "_label": "Height"
        }
      ],
      "value": 20,
      "unit": {
        "id": "http://vocab.getty.edu/aat/300379100",
        "type": "MeasurementUnit",
        "_label": "inches"
      },
      "identified_by": [
        {
          "type": "Name",
          "classified_as": [
            {
              "id": "http://vocab.getty.edu/aat/300404669",
              "type": "Type",
              "_label": "Display Title"
            }
          ],
          "content": "20 inches high"
        }
      ]
    }
  ]
}