{
  "@context": "https://linked.art/ns/v1/linked-art.json",
  "id": "https://linked.art/example/object/51",
  "type": "HumanMadeObject",
  "_label": "Painting",
  "classified_as": [
    {
      "id": "http://vocab.getty.edu/aat/300033618",
      "type": "Type",
      "_label": "Painting",
      "classified_as": [
        {
          "id": "http://vocab.getty.edu/aat/300435443",
          "type": "Type",
          "_label": "Type of Work"
        }
      ]
    },
    {
      "id": "http://vocab.getty.edu/aat/300133025",
      "type": "Type",
      "_label": "Artwork"
    }
  ],
  "referred_to_by": [
    {
      "type": "LinguisticObject",
      "classified_as": [
        {
          "id": "http://vocab.getty.edu/aat/300229535",
          "type": "Type",
          "_label": "Environmental Conditions Statement",
          "classified_as": [
            {
              "id": "http://vocab.getty.edu/aat/300418049",
              "type": "Type",
              "_label": "Brief Text"
            }
          ]
        }
      ],
      "content": "Light level: 150 &#177;50 lux; Relative humidity: 55 &#177;5%; Temperature 21 &#177;1 &deg;C."
    }
  ]
}