{
  "@context": "https://linked.art/ns/v1/linked-art.json",
  "id": "https://linked.art/example/object/38",
  "type": "HumanMadeObject",
  "_label": "Example Painting",
  "classified_as": [
    {
      "id": "http://vocab.getty.edu/aat/300033618",
      "type": "Type",
      "_label": "Painting",
      "classified_as": [
        {
          "id": "http://vocab.getty.edu/aat/300435443",
          "type": "Type",
          "_label": "Type of Work"
        }
      ]
    },
    {
      "id": "http://vocab.getty.edu/aat/300133025",
      "type": "Type",
      "_label": "Artwork"
    }
  ],
  "attributed_by": [
    {
      "type": "AttributeAssignment",
      "assigned": {
        "id": "https://linked.art/example/object/39",
        "type": "HumanMadeObject",
        "_label": "Yet Another Example Painting",
        "classified_as": [
          {
            "id": "http://vocab.getty.edu/aat/300033618",
            "type": "Type",
            "_label": "Painting"
          },
          {
            "id": "http://vocab.getty.edu/aat/300133025",
            "type": "Type",
            "_label": "Artwork"
          }
        ]
      }
    }
  ]
}