{
  "@context": "https://linked.art/ns/v1/linked-art.json",
  "id": "https://linked.art/example/object/70",
  "type": "HumanMadeObject",
  "_label": "Commissioned Landscape Painting",
  "classified_as": [
    {
      "id": "http://vocab.getty.edu/aat/300033618",
      "type": "Type",
      "_label": "Painting",
      "classified_as": [
        {
          "id": "http://vocab.getty.edu/aat/300435443",
          "type": "Type",
          "_label": "Type of Work"
        }
      ]
    }
  ],
  "referred_to_by": [
    {
      "type": "LinguisticObject",
      "classified_as": [
        {
          "id": "http://vocab.getty.edu/aat/300435416",
          "type": "Type",
          "_label": "Description",
          "classified_as": [
            {
              "id": "http://vocab.getty.edu/aat/300418049",
              "type": "Type",
              "_label": "Brief Text"
            }
          ]
        }
      ],
      "content": "A commissioned painting by Artist"
    }
  ]
}