{
  "@context": "https://linked.art/ns/v1/linked-art.json",
  "id": "https://linked.art/example/object/27",
  "type": "HumanMadeObject",
  "_label": "Painting",
  "classified_as": [
    {
      "id": "http://vocab.getty.edu/aat/300033618",
      "type": "Type",
      "_label": "Painting",
      "classified_as": [
        {
          "id": "http://vocab.getty.edu/aat/300435443",
          "type": "Type",
          "_label": "Type of Work"
        }
      ]
    },
    {
      "id": "http://vocab.getty.edu/aat/300133025",
      "type": "Type",
      "_label": "Artwork"
    }
  ],
  "shows": [
    {
      "type": "VisualItem",
      "digitally_shown_by": [
        {
          "type": "DigitalObject",
          "_label": "Digitized Image of Painting",
          "classified_as": [
            {
              "id": "http://vocab.getty.edu/aat/300215302",
              "type": "Type",
              "_label": "Digital Image"
            }
          ],
          "format": "image/jpeg",
          "access_point": [
            {
              "id": "http://example.org/painting/image.jpg",
              "type": "DigitalObject"
            }
          ]
        }
      ]
    }
  ]
}