{
  "@context": "https://linked.art/ns/v1/linked-art.json",
  "id": "https://linked.art/example/object/62",
  "type": "HumanMadeObject",
  "_label": "Paint sample",
  "removed_by": [
    {
      "type": "PartRemoval",
      "carried_out_by": [
        {
          "type": "Person",
          "_label": "Conservator"
        }
      ],
      "diminished": {
        "type": "HumanMadeObject",
        "_label": "Painting",
        "classified_as": [
          {
            "id": "http://vocab.getty.edu/aat/300033618",
            "type": "Type",
            "_label": "Painting",
            "classified_as": [
              {
                "id": "http://vocab.getty.edu/aat/300435443",
                "type": "Type",
                "_label": "Type of Work"
              }
            ]
          }
        ]
      }
    }
  ]
}