{
  "@context": "https://linked.art/ns/v1/linked-art.json",
  "id": "https://linked.art/example/object/14",
  "type": "HumanMadeObject",
  "_label": "St. Sebastian",
  "classified_as": [
    {
      "id": "http://vocab.getty.edu/aat/300033618",
      "type": "Type",
      "_label": "Painting",
      "classified_as": [
        {
          "id": "http://vocab.getty.edu/aat/300435443",
          "type": "Type",
          "_label": "Type of Work"
        }
      ]
    },
    {
      "id": "http://vocab.getty.edu/aat/300133025",
      "type": "Type",
      "_label": "Artwork"
    }
  ],
  "identified_by": [
    {
      "type": "Name",
      "content": "St. Sebastian"
    }
  ],
  "referred_to_by": [
    {
      "type": "LinguisticObject",
      "classified_as": [
        {
          "id": "http://vocab.getty.edu/aat/300435429",
          "type": "Type",
          "_label": "Material Statement",
          "classified_as": [
            {
              "id": "http://vocab.getty.edu/aat/300418049",
              "type": "Type",
              "_label": "Brief Text"
            }
          ]
        }
      ],
      "content": "Oil on canvas"
    }
  ],
  "dimension": [
    {
      "type": "Dimension",
      "_label": "Height",
      "classified_as": [
        {
          "id": "http://vocab.getty.edu/aat/300055644",
          "type": "Type",
          "_label": "Height"
        }
      ],
      "value": 153,
      "unit": {
        "id": "http://vocab.getty.edu/aat/300379098",
        "type": "MeasurementUnit",
        "_label": "centimeters"
      }
    },
    {
      "type": "Dimension",
      "_label": "Width",
      "classified_as": [
        {
          "id": "http://vocab.getty.edu/aat/300055647",
          "type": "Type",
          "_label": "Width"
        }
      ],
      "value": 118,
      "unit": {
        "id": "http://vocab.getty.edu/aat/300379098",
        "type": "MeasurementUnit",
        "_label": "centimeters"
      }
    }
  ],
  "made_of": [
    {
      "id": "http://vocab.getty.edu/aat/300015050",
      "type": "Material",
      "_label": "oil"
    }
  ],
  "part": [
    {
      "type": "HumanMadeObject",
      "_label": "Canvas Support",
      "classified_as": [
        {
          "id": "http://vocab.getty.edu/aat/300014844",
          "type": "Type",
          "_label": "Support",
          "classified_as": [
            {
              "id": "http://vocab.getty.edu/aat/300241583",
              "type": "Type",
              "_label": "Part Type"
            }
          ]
        }
      ],
      "made_of": [
        {
          "id": "http://vocab.getty.edu/aat/300014078",
          "type": "Material",
          "_label": "canvas"
        }
      ]
    }
  ]
}