{
  "@context": "https://linked.art/ns/v1/linked-art.json",
  "id": "https://linked.art/example/object/61",
  "type": "HumanMadeObject",
  "_label": "Painting",
  "classified_as": [
    {
      "id": "http://vocab.getty.edu/aat/300033618",
      "type": "Type",
      "_label": "Painting",
      "classified_as": [
        {
          "id": "http://vocab.getty.edu/aat/300435443",
          "type": "Type",
          "_label": "Type of Work"
        }
      ]
    },
    {
      "id": "http://vocab.getty.edu/aat/300133025",
      "type": "Type",
      "_label": "Artwork"
    }
  ],
  "produced_by": {
    "type": "Production",
    "assigned_by": [
      {
        "type": "AttributeAssignment",
        "classified_as": [
          {
            "id": "http://vocab.getty.edu/aat/300404908",
            "type": "Type",
            "_label": "Obsolete"
          }
        ],
        "timespan": {
          "type": "TimeSpan",
          "begin_of_the_begin": "1923-07-20",
          "end_of_the_end": "1923-07-21"
        },
        "carried_out_by": [
          {
            "type": "Person",
            "_label": "Paintings Curator"
          }
        ],
        "assigned": {
          "type": "Production",
          "carried_out_by": [
            {
              "type": "Person",
              "_label": "J. Artist"
            }
          ]
        },
        "assigned_property": "part_of"
      }
    ]
  }
}