{
  "@context": "https://linked.art/ns/v1/linked-art.json",
  "id": "https://linked.art/example/object/16",
  "type": "HumanMadeObject",
  "_label": "St. Sebastian",
  "classified_as": [
    {
      "id": "http://vocab.getty.edu/aat/300033618",
      "type": "Type",
      "_label": "Painting",
      "classified_as": [
        {
          "id": "http://vocab.getty.edu/aat/300435443",
          "type": "Type",
          "_label": "Type of Work"
        }
      ]
    },
    {
      "id": "http://vocab.getty.edu/aat/300133025",
      "type": "Type",
      "_label": "Artwork"
    }
  ],
  "referred_to_by": [
    {
      "type": "LinguisticObject",
      "classified_as": [
        {
          "id": "http://vocab.getty.edu/aat/300435438",
          "type": "Type",
          "_label": "Provenance Statement",
          "classified_as": [
            {
              "id": "http://vocab.getty.edu/aat/300418049",
              "type": "Type",
              "_label": "Brief Text"
            }
          ]
        }
      ],
      "content": "Cardinal Neri Corsini (1685-1770); Purchased by the Italian government form Prince Tommaso Corsini (1884)"
    },
    {
      "type": "LinguisticObject",
      "_label": "Vlieghe, CorpRub 8 (1972-73), no.144."
    }
  ],
  "carries": [
    {
      "type": "InformationObject",
      "about": [
        {
          "type": "Type",
          "_label": "Religious, Devotional"
        }
      ]
    }
  ]
}