{
  "@context": "https://linked.art/ns/v1/linked-art.json",
  "id": "https://linked.art/example/object/34",
  "type": "HumanMadeObject",
  "_label": "Self Portrait",
  "classified_as": [
    {
      "id": "http://vocab.getty.edu/aat/300033618",
      "type": "Type",
      "_label": "Painting",
      "classified_as": [
        {
          "id": "http://vocab.getty.edu/aat/300435443",
          "type": "Type",
          "_label": "Type of Work"
        }
      ]
    },
    {
      "id": "http://vocab.getty.edu/aat/300133025",
      "type": "Type",
      "_label": "Artwork"
    }
  ],
  "shows": [
    {
      "type": "VisualItem",
      "represents": [
        {
          "type": "Actor",
          "_label": "Artist"
        }
      ]
    }
  ],
  "produced_by": {
    "type": "Production",
    "carried_out_by": [
      {
        "type": "Actor",
        "_label": "Artist"
      }
    ]
  }
}