{
  "@context": "https://linked.art/ns/v1/linked-art.json",
  "id": "https://linked.art/example/object/54",
  "type": "HumanMadeObject",
  "_label": "Painting",
  "classified_as": [
    {
      "id": "http://vocab.getty.edu/aat/300033618",
      "type": "Type",
      "_label": "Painting",
      "classified_as": [
        {
          "id": "http://vocab.getty.edu/aat/300435443",
          "type": "Type",
          "_label": "Type of Work"
        }
      ]
    },
    {
      "id": "http://vocab.getty.edu/aat/300133025",
      "type": "Type",
      "_label": "Artwork"
    }
  ],
  "produced_by": {
    "type": "Production",
    "timespan": {
      "type": "TimeSpan",
      "begin_of_the_begin": "1780-03-05T00:00:00Z",
      "end_of_the_end": "1780-03-06T00:00:00Z"
    },
    "took_place_at": [
      {
        "type": "Place",
        "_label": "Artist's Studio"
      }
    ],
    "carried_out_by": [
      {
        "type": "Person",
        "_label": "Artist"
      }
    ]
  }
}