{
  "@context": "https://linked.art/ns/v1/linked-art.json",
  "id": "https://linked.art/example/object/49",
  "type": "HumanMadeObject",
  "_label": "Marble Sculpture",
  "classified_as": [
    {
      "id": "http://vocab.getty.edu/aat/300047090",
      "type": "Type",
      "_label": "Sculpture",
      "classified_as": [
        {
          "id": "http://vocab.getty.edu/aat/300435443",
          "type": "Type",
          "_label": "Type of Work"
        }
      ]
    },
    {
      "id": "http://vocab.getty.edu/aat/300133025",
      "type": "Type",
      "_label": "Artwork"
    }
  ],
  "made_of": [
    {
      "id": "http://vocab.getty.edu/aat/300011443",
      "type": "Material",
      "_label": "marble"
    }
  ]
}