{
  "@context": "https://linked.art/ns/v1/linked-art.json",
  "id": "https://linked.art/example/object/11",
  "type": "HumanMadeObject",
  "_label": "Black and White Photograph of 'St. Sebastian'",
  "classified_as": [
    {
      "id": "http://vocab.getty.edu/aat/300128359",
      "type": "Type",
      "_label": "Black and White Photograph",
      "classified_as": [
        {
          "id": "http://vocab.getty.edu/aat/300435443",
          "type": "Type",
          "_label": "Type of Work"
        }
      ]
    }
  ]
}